{
  "context_requirements": [
    "plan acceptance criteria",
    "exact approved patch",
    "result state",
    "registered verification evidence"
  ],
  "disclosure_class": "REMOTE_BY_EXPLICIT_MANIFEST",
  "independence": {
    "must_differ_from_assignment_ref": {
      "digest": "sha256:58353a808270d002a61728f3b532bae3e7505c500ad8c4b4663cd3286f3849e6",
      "id": "asg_58353a808270d002a61728f3b532bae3"
    },
    "must_not_receive_implementer_transcript": true,
    "must_use_separate_context_manifest": true
  },
  "metadata": {
    "fixture_only": true,
    "note": "Planning/conformance fixture; not production qualification or provider evidence."
  },
  "plan_ref": {
    "digest": "sha256:48e474ac89fbe3d9498c83fb6d4254ba41677246fcbcc6f0be352bc25c852118",
    "id": "pln_48e474ac89fbe3d9498c83fb6d4254ba"
  },
  "required_capabilities": [
    "review_actual_patch",
    "evaluate_registered_verification"
  ],
  "requirement_id": "req_fa4d43ed807fd2c6885aab05b7610c2f",
  "role": "REVIEWER",
  "schema": "engineering-system/intelligence-requirement/m0-v1",
  "semantic_digest": "sha256:fa4d43ed807fd2c6885aab05b7610c2f4816fe9e154051cfed60cd458752165d",
  "task_kind": "SOFTWARE_CHANGE"
}
